article_id,date,title,url,domain,tags,is_commentary,entities,relevance,event_id,burst_start_date,classification_status
1.0,2021-01-03 05:56:39,ステーブルコインとは？JPYC・USDC・銘柄比較・日本規制・買い方【2026】 - bittimes.net,https://bittimes.net/feature/96857.html,bittimes.net,競合・市場環境、解説・論説、制度・規制、市場・統計、提携・連携,1.0,ソニー銀行、SBIホールディングス、3メガバンク（三菱UFJ・みずほ・三井住友）、Circle社,75.0,EVT-20210103-01,2021-01-03,done
2.0,2023-09-09 09:00:00,【Web3転職・副業】JPYCはステーブルコインからグローバルスタンダードを目指す！JPYC岡部さんにこれからのJPY… - PlusWeb3,https://plus-web3.com/media/interview-jpyc/,plus-web3.com,解説・論説,1.0,JPYC株式会社、岡部代表取締役、Circle社、金融庁,85.0,,,done
3.0,2025-08-17 17:00:00,国内初の円建てステーブルコイン、金融庁承認へ JPYCが秋にも発行 - 日本経済新聞,https://www.nikkei.com/article/DGXZQOUB146U80U5A810C2000000/,nikkei.com,制度・規制、発行・資金,0.0,JPYC、金融庁、資金移動業,95.0,EVT-20250817-01,2025-08-17,done
4.0,2025-08-17 19:37:16,金融庁、日本円建てステーブルコイン「JPYC」承認へ＝日本経済新聞 - CoinPost,https://coinpost.jp/?p=643009,coinpost.jp,制度・規制、解説・論説,1.0,金融庁、岡部典孝、Tether、Circle,95.0,EVT-20250817-01,2025-08-17,done
5.0,2025-08-17 20:28:22,金融庁、国内初の円建てステーブルコインを承認へ──JPYC岡部代表、報道内容認める - NADA NEWS,https://www.nadanews.com/308577/,nadanews.com,制度・規制、発行・資金,0.0,金融庁、岡部典孝、改正資金決済法,95.0,EVT-20250817-01,2025-08-17,done
6.0,2025-08-18 01:00:00,ステーブルコイン発行事業者のJPYC，今月中に資金移動業者として登録へ - bitbank,https://bitbank.cc/knowledge/breaking/article/6l6r1mq72oh,bitbank.cc,制度・規制,0.0,金融庁、資金移動業者、JPYC,85.0,EVT-20250817-01,2025-08-17,done
7.0,2025-08-18 02:00:00,円建てステーブルコイン、国内初承認へ JPYC、秋にも発行 - 日本経済新聞,https://www.nikkei.com/article/DGKKZO90725440Y5A810C2MM8000/,nikkei.com,制度・規制、発行・資金,0.0,金融庁、資金移動業、JPYC,95.0,EVT-20250817-01,2025-08-17,done
8.0,2025-08-18 03:17:56,金融庁、国内初の円建てステーブルコイン「JPYC」を承認へ｜今秋にも販売開始か＝報道 - bittimes.net,https://bittimes.net/news/209564.html,bittimes.net,制度・規制、発行・資金,0.0,金融庁、JPYC社、改正資金決済法、岡部典孝,95.0,EVT-20250817-01,2025-08-17,done
9.0,2025-08-18 06:51:00,金融庁、国内初の円建てステーブルコイン承認へ＝JPYCが今秋発行 - BeInCrypto,https://jp.beincrypto.com/jpyc-yen-backed-stablecoin-to-be-approved-fsa/,jp.beincrypto.com,制度・規制、発行・資金,0.0,金融庁、JPYC（企業）、岡部典孝、資金移動業,95.0,EVT-20250817-01,2025-08-17,done
10.0,2025-08-18 12:42:56,日本のステーブルコイン完全ガイド【2025年最新】規制・取引所・JPYC承認の全貌解説 - CoinChoice,https://coinchoice.net/japan-stablecoins-complete-guide-2025-latest-regulation-exchanges-jpyc-approval/,coinchoice.net,制度・規制、市場・統計、解説・論説,1.0,金融庁、SBI VCトレード、Circle、改正資金決済法,75.0,EVT-20250817-01,2025-08-17,done
11.0,2025-08-18 12:44:05,JPYCとは？金融庁承認の日本初円建てステーブルコインの全貌解説【2025年最新】 - CoinChoice,https://coinchoice.net/jpyc-what-is-japans-first-yen-stablecoin-fsa-approved-2025-latest-guide/,coinchoice.net,制度・規制、解説・論説,1.0,JPYC株式会社、金融庁、岡部典孝、改正資金決済法,95.0,EVT-20250817-01,2025-08-17,done
12.0,2025-08-18 15:43:11,JPYC発行の円建てステーブルコイン、金融庁が国内初の承認へ - icobench.com,https://icobench.com/jp/news/japan-fsa-approves-yen-stablecoin-jpyc-launch/,icobench.com,制度・規制、発行・資金,0.0,金融庁、改正資金決済法、TerraUSD,95.0,EVT-20250817-01,2025-08-17,done
13.0,2025-08-18 17:36:01,【速報】金融庁、JPYCを資金移動業者として登録──国内初の円建てステーブルコインへ、岡部代表「早期発行」を表明 - NADA NEWS,https://www.nadanews.com/308634/,nadanews.com,制度・規制、取扱い・対応,0.0,金融庁、岡部典孝、資金決済法,95.0,EVT-20250817-01,2025-08-17,done
14.0,2025-08-18 17:45:17,金融庁、JPYCを資金移動業に登録 円建てのステーブルコイン発行へ - 日本経済新聞,https://www.nikkei.com/article/DGXZQOUB186IJ0Y5A810C2000000/,nikkei.com,制度・規制、発行・資金,0.0,金融庁、資金移動業、イーサリアム,95.0,EVT-20250817-01,2025-08-17,done
15.0,2025-08-18 23:20:43,円建てステーブルコイン発行へ ステーブルコインとは？初心者にもわかる基礎知識 - coki.jp,https://coki.jp/article/column/57086/,coki.jp,制度・規制、解説・論説、競合・市場環境,1.0,JPYC株式会社、金融庁、改正資金決済法、三菱UFJ信託銀行,85.0,EVT-20250817-01,2025-08-17,done
16.0,2025-08-19 00:00:00,円建てのステーブルコイン、今秋にも発行 国内ベンチャー「JPYC」が実施へ - 産経ニュース,https://www.sankei.com/article/20250819-PPLCQJOTBVJOPJJJJIPHS4EJ5A/,sankei.com,発行・資金、制度・規制,0.0,JPYC、金融庁、岡部典孝,95.0,EVT-20250817-01,2025-08-17,done
18.0,2025-08-19 01:00:00,JPYC、ステーブルコイン発行へ 「資金移動業」取得し国内初 - nikkinonline.com,https://www.nikkinonline.com/article/305602,nikkinonline.com,制度・規制、発行・資金,0.0,JPYC、第二種資金移動業、岡部代表取締役,95.0,EVT-20250817-01,2025-08-17,done
17.0,2025-08-19 01:00:00,サークルが日本初の承認済みステーブルコインに投資 - BeInCrypto,https://jp.beincrypto.com/japans-first-approved-stablecoin-is-invested-by-circle/,jp.beincrypto.com,制度・規制、発行・資金、提携・連携、解説・論説,1.0,Circle（サークル）、金融庁、岡部典孝、JPYC株式会社,95.0,EVT-20250817-01,2025-08-17,done
19.0,2025-08-19 01:00:00,【国内初】日本円建ステーブルコイン発行へ－資金移動業者の登録を取得 - JPYC株式会社,https://corporate.jpyc.co.jp/news/posts/first-yen-stablecoin-jpyc,corporate.jpyc.co.jp,,,,,,,failed
20.0,2025-08-19 01:00:00,日本、今秋にも初の円建てステーブルコインを承認へ - abc株式会社,https://www.gfa.co.jp/crypto/news/market-news/news-1497/,gfa.co.jp,制度・規制、発行・資金,0.0,金融庁、JPYC社、岡部典孝、改正資金決済法,95.0,EVT-20250817-01,2025-08-17,done
21.0,2025-08-19 11:03:56,アステリアは連日Ｓ高、ＪＰＹＣ出資企業として人気化 - かぶたん,https://kabutan.jp/news/marketnews/?b=n202508190394,kabutan.jp,市場・統計,0.0,アステリア、パーソルホールディングス、アイフル,45.0,EVT-20250817-01,2025-08-17,done
22.0,2025-08-19 15:40:00,PayPayに強力な対抗馬？ 日本円連動ステーブルコイン「JPYC」を金融庁が認可、今秋始動 - CNET Japan,https://japan.cnet.com/article/35236850/,japan.cnet.com,制度・規制、解説・論説,1.0,JPYC社、岡部典孝、PayPay、金融庁,95.0,EVT-20250817-01,2025-08-17,done
23.0,2025-08-19 16:00:00,アステリアは連日Ｓ高、ＪＰＹＣ出資企業として人気化◇ - ライブドアニュース,https://news.livedoor.com/article/detail/29395442/?from_page=internal,news.livedoor.com,制度・規制、市場・統計,0.0,アステリア、金融庁、資金移動業者登録,75.0,EVT-20250817-01,2025-08-17,done
24.0,2025-08-19 16:00:00,【ステーブルコインの何がすごいのか？】ＪＰＹＣが国内初の合法円ステーブルコイン発行体に、関連銘柄も急騰 - kabu-ir.com,https://kabu-ir.com/article/517693841.html,kabu-ir.com,制度・規制、提携・連携、解説・論説,1.0,JPYC株式会社、資金決済法、アステリア、SBIホールディングス,95.0,EVT-20250817-01,2025-08-17,done
25.0,2025-08-19 16:00:00,日本円建てステーブルコイン「JPYC」登場 金融庁が国内初の登録 - ITmedia,https://www.itmedia.co.jp/news/articles/2508/19/news087.html,itmedia.co.jp,制度・規制、発行・資金,0.0,JPYC株式会社、金融庁、資金移動業者、改正資金決済法,95.0,EVT-20250817-01,2025-08-17,done
26.0,2025-08-19 16:00:00,国産ステーブルコイン、今秋発行へ 初の円建て、金融庁が承認―ＪＰＹＣ - 時事ドットコム,https://www.jiji.com/jc/article?k=2025081900846&g=eco,jiji.com,制度・規制、発行・資金,0.0,JPYC、金融庁、岡部典孝,95.0,EVT-20250817-01,2025-08-17,done
27.0,2025-08-19 16:00:00,ステーブルコインの発行を国内で初めて認可、国債保有者としての期待も（久保田博幸） - エキスパート - Yahoo!ニュース,https://news.yahoo.co.jp/expert/articles/3a2ba581bb739f8467caca7cac8d9428cbae18f8,news.yahoo.co.jp,制度・規制、発行・資金、解説・論説,1.0,金融庁、JPYC、改正資金決済法、国際決済銀行,85.0,EVT-20250817-01,2025-08-17,done
28.0,2025-08-19 20:00:00,JPYCが国内初の「円建てステーブルコイン」発行へ。岡部社長が「暗号資産」との違いを強調 - Business Insider Japan,https://www.businessinsider.jp/article/2508-jpyc-yen-denominated-stablecoin/,businessinsider.jp,制度・規制、発行・資金,0.0,岡部典孝、関東財務局、Circle,95.0,EVT-20250817-01,2025-08-17,done
36.0,2025-08-20 01:00:00,JPYC株式会社が日本円建ステーブルコインを初発行－資金移動業者としての新たな一歩 - ニュースメディアVOIX,https://voix.jp/money/cryptocurrency/14200/,voix.jp,発行・資金、制度・規制,0.0,JPYC株式会社、資金移動業者、改正資金決済法,95.0,EVT-20250817-01,2025-08-17,done
34.0,2025-08-20 01:00:00,注目！結城はるみの特選テーマ株 国内初のステーブルコインJPYC発行へ！「ステーブルコイン、JPYC関連銘柄」総チェック | 個別株 - 株探ニュース - かぶたん,https://kabutan.jp/news/marketnews/?b=n202508190485,kabutan.jp,制度・規制、解説・論説、競合・市場環境,1.0,金融庁、JPモルガン・チェース、JPYC関連銘柄,85.0,EVT-20250817-01,2025-08-17,done
33.0,2025-08-20 01:00:00,デジタルアセットマーケッツ、電算システムのステーブルコイン決済送金基盤の構築支援 - NADA NEWS,https://www.nadanews.com/308698/,nadanews.com,提携・連携、制度・規制,0.0,デジタルアセットマーケッツ、電算システム、インタートレード,45.0,EVT-20250817-01,2025-08-17,done
35.0,2025-08-20 01:00:00,ユーザーの保有・送金額に上限なし──円建てステーブルコイン発行・償還サービス、今秋スタート：JPYC岡部氏 - NADA NEWS,https://www.nadanews.com/308717/,nadanews.com,制度・規制、発行・資金,0.0,岡部典孝、資金移動業者、JPYC EX、関東財務局,95.0,EVT-20250817-01,2025-08-17,done
30.0,2025-08-20 01:00:00,日本円に連動する初のステーブルコイン JPYCが資金移動業登録 - Impress Watch,https://www.watch.impress.co.jp/docs/news/2039701.html,watch.impress.co.jp,制度・規制、発行・資金,0.0,資金移動業者登録、Ethereum、Avalanche、Polygon,95.0,EVT-20250817-01,2025-08-17,done
29.0,2025-08-20 01:00:00,JPYC、日本初の円ステーブルコインを発表し、デジタル金融における歴史的マイルストーンを記録 - Binance,https://www.binance.com/ja/square/post/28532318382818,binance.com,制度・規制、発行・資金,0.0,金融庁、岡部則孝、Ethereum、Polygon,95.0,EVT-20250817-01,2025-08-17,done
32.0,2025-08-20 01:00:00,アステリアは連日Ｓ高、ＪＰＹＣ出資企業として人気化◇ (2025年8月19日掲載) - ライブドアニュース,https://news.livedoor.com/topics/detail/29395442/,news.livedoor.com,制度・規制、市場・統計,0.0,アステリア、金融庁、資金決済法,75.0,EVT-20250817-01,2025-08-17,done
31.0,2025-08-20 01:00:00,「日本版プロジェクト・クリプト」推進へ 国民民主党の玉木代表、ステーブルコインの支援を表明 - CoinPost,https://coinpost.jp/?p=643352,coinpost.jp,制度・規制、提携・連携,0.0,国民民主党、玉木代表、JPYC株式会社、金融庁,75.0,EVT-20250817-01,2025-08-17,done
37.0,2025-08-20 02:00:00,円建てステーブルコイン、JPYCが9月にも発行 即時・低コストで - 日本経済新聞,https://www.nikkei.com/article/DGXZQOUB190VI0Z10C25A8000000/,nikkei.com,発行・資金、提携・連携,0.0,JPYC、金融庁、ブロックチェーン,95.0,EVT-20250817-01,2025-08-17,done
38.0,2025-08-20 05:00:00,ステーブルコインのJPYC代表「デジタル円を数十億人に届ける」 - 日本経済新聞,https://www.nikkei.com/article/DGXZQOUB1964Z0Z10C25A8000000/,nikkei.com,制度・規制、発行・資金,0.0,JPYC（フィンテック企業）、金融庁、岡部典孝,95.0,EVT-20250817-01,2025-08-17,done
39.0,2025-08-20 08:00:59,JPYC、国内初の資金移動業者型ステーブルコインの強みとは？POS決済など、日本円での通常決済も視野に - ペイメントナビ,https://paymentnavi.com/paymentnews/164613.html,paymentnavi.com,制度・規制、発行・資金、解説・論説,1.0,岡部典孝、Circle、金融庁,85.0,EVT-20250817-01,2025-08-17,done
40.0,2025-08-21 00:00:00,日本円建ステーブルコインJPYCと企業システムをノーコード連携 | プレスリリース | ニュース - アステリア株式会社,https://jp.asteria.com/news/2025082124897/,jp.asteria.com,取扱い・対応、提携・連携、実証実験,0.0,アステリア株式会社、JPYC株式会社、ASTERIA Warp,75.0,EVT-20250817-01,2025-08-17,done
42.0,2025-08-21 01:00:00,JPYC、日本初の円建てステーブルコイン発行へ ―― ステーブルコインは普及するか - newspicks.com,https://newspicks.com/news/14908919/body/,newspicks.com,制度・規制、解説・論説,1.0,JPYC株式会社、資金移動業者、米国財務省,95.0,EVT-20250817-01,2025-08-17,done
41.0,2025-08-21 01:00:00,大阪初開催！「JPYC React SDK Hands-on」＆代表岡部による次世代決済トークセッション - PR TIMES,https://prtimes.jp/main/html/rd/p/000000272.000054018.html,prtimes.jp,活用事例,0.0,React SDK、Slash Vision Labs、Orbs Japan,65.0,,,done
43.0,2025-08-21 12:21:28,「ステーブルコイン」が5位にランク、資金移動業者に登録されたJPYCが円建て発行へ＜注目テーマ - かぶたん,https://kabutan.jp/news/marketnews/?b=n202508210532,kabutan.jp,制度・規制、市場・統計、競合・市場環境,0.0,JPYC、資金移動業者、デジタルアセットマーケッツ、電算システム,85.0,EVT-20250817-01,2025-08-17,done
44.0,2025-08-21 14:54:52,日本円ステーブルコイン「JPYC」と企業システムをノーコードで連携、アステリアが新アダプター開発へ - NADA NEWS,https://www.nadanews.com/309018/,nadanews.com,取扱い・対応、提携・連携、制度・規制,0.0,アステリア、JPYC株式会社、ブロックチェーン推進協会,85.0,EVT-20250817-01,2025-08-17,done
45.0,2025-08-21 16:00:00,電算システムがストップ高､｢ステーブルコイン｣で業容拡大期待 - 四季報オンライン,https://shikiho.toyokeizai.net/news/0/900119,shikiho.toyokeizai.net,,0.0,,0.0,,,done
46.0,2025-08-21 16:00:00,JPYC株式会社の代表取締役・岡部典孝がブロックチェーン推進協会の副代表理事に就任 - PR TIMES,https://prtimes.jp/main/html/rd/p/000000275.000054018.html,prtimes.jp,提携・連携,0.0,ブロックチェーン推進協会（BCCC）、岡部典孝、ステーブルコイン普及推進部会,65.0,,,done
47.0,2025-08-21 16:10:12,ステーブルコイン「JPYC」は金融検閲の突破口になり、経済活動の自由・表現の自由を守る!? - あたらしい経済,https://www.neweconomy.jp/features/stablecoin/489434,neweconomy.jp,制度・規制、解説・論説,1.0,金融庁、岡部典孝、AltPay株式会社,75.0,EVT-20250817-01,2025-08-17,done
48.0,2025-08-21 19:47:14,アステリア、JPYCのステーブルコインと連携 手作業なく送金 - 日本経済新聞,https://www.nikkei.com/article/DGXZQOUC2192E0R20C25A8000000/,nikkei.com,提携・連携、活用事例,0.0,アステリア、JPYC、財務会計システム,75.0,EVT-20250817-01,2025-08-17,done
51.0,2025-08-22 01:00:00,アステリアが発表した新JPYCアダプターで企業システムにおけるステーブルコイン普及を加速 - ニュースメディアVOIX,https://voix.jp/money/cryptocurrency/14442/,voix.jp,提携・連携、取扱い・対応,0.0,アステリア株式会社、JPYC株式会社、ASTERIA Warp、ブロックチェーン推進協会,85.0,EVT-20250817-01,2025-08-17,done
50.0,2025-08-22 01:00:00,【材料】 アステリアは一段高、円建ステーブルコインの決済データをノーコードで連携へ - かぶたん,https://kabutan.jp/news/marketnews/?b=n202508210557,kabutan.jp,取扱い・対応、提携・連携、活用事例,0.0,アステリア、JPYCアダプター、ASTERIA Warp,75.0,EVT-20250817-01,2025-08-17,done
49.0,2025-08-22 01:00:00,アステリア 日本円建ステーブルコインJPYCと企業システムをノーコード連携Warp専用「新JPYCアダプター」で企業におけるステーブルコインの普及を促進- 日本経済新聞,https://www.nikkei.com/nkd/disclosure/tdnr/20250821545218/,nikkei.com,取扱い・対応、提携・連携,0.0,アステリア、Warp、新JPYCアダプター,75.0,EVT-20250817-01,2025-08-17,done
52.0,2025-08-22 16:00:32,JPYC株式会社の岡部典孝がブロックチェーン推進協会の副代表理事に就任決定 - ニュースメディアVOIX,https://voix.jp/money/cryptocurrency/14562/,voix.jp,提携・連携,0.0,岡部典孝、ブロックチェーン推進協会（BCCC）、資金移動業者登録,65.0,EVT-20250817-01,2025-08-17,done
53.0,2025-08-23 01:00:00,アステリア、国産ステーブルコイン「JPYC」連携を発表｜ノーコードで決済DXを加速 - bittimes.net,https://bittimes.net/news/209734.html,bittimes.net,提携・連携、取扱い・対応、活用事例,0.0,アステリア、ASTERIA Warp、JPYC株式会社,85.0,EVT-20250817-01,2025-08-17,done
54.0,2025-08-23 01:00:00,日経平均の調整続くなか投資資金が殺到している“激アツ銘柄”の正体…国内初「日本円建ステーブルコイン」発行見通しで株価爆騰【昨日動いた個別株】 - ゴールドオンライン,https://gentosha-go.com/articles/-/71283,gentosha-go.com,取扱い・対応、提携・連携,0.0,アステリア、電算システムホールディングス、ASTERIA Warp,65.0,EVT-20250817-01,2025-08-17,done
55.0,2025-08-23 01:00:00,アステリア、JPYCノーコード連携で日本円ステーブルコイン普及促進 - plus-web3.com,https://plus-web3.com/media/latestnews_1000_4890/,plus-web3.com,提携・連携、取扱い・対応、活用事例,0.0,アステリア、ASTERIA Warp、JPYCアダプター、ブロックチェーン推進協会,85.0,EVT-20250817-01,2025-08-17,done
56.0,2025-08-23 01:00:00,アステリアは一段高、円建ステーブルコインの決済データをノーコードで連携へ - みんかぶ,https://minkabu.jp/news/4319124,minkabu.jp,取扱い・対応、提携・連携,0.0,アステリア、ASTERIA Warp、JPYCアダプター,75.0,EVT-20250817-01,2025-08-17,done
57.0,2025-08-23 17:00:00,株ブロガー・さなさえ：ステーブルコインへ思惑動く！わたしが気になる注目株はコレでっす♪【FISCOソーシャルレポーター】 - かぶたん,https://kabutan.jp/news/marketnews/?b=n202508230167,kabutan.jp,競合・市場環境、解説・論説,1.0,SBIホールディングス、アステリア、JPYC株式会社,65.0,EVT-20250817-01,2025-08-17,done
58.0,2025-08-24 01:00:00,仮想通貨ニュース週間まとめ「金融庁・トヨタ・JPYC・パウエル砲」などの注目記事 - bittimes.net,https://bittimes.net/news/209793.html,bittimes.net,提携・連携、取扱い・対応、市場・統計,0.0,アステリア、JPYC株式会社、金融庁、トヨタ・ブロックチェーン・ラボ,25.0,,,done
59.0,2025-08-24 08:00:00,金融庁、国内初の円建てステーブルコインを承認へ──JPYC岡部代表、報道内容認める - NADA NEWS,https://www.nadanews.com/309155/,nadanews.com,制度・規制、発行・資金,0.0,金融庁、JPYC社、岡部典孝、改正資金決済法,95.0,EVT-20250817-01,2025-08-17,done
60.0,2025-08-25 15:00:00,今夜のNEXT 初の円建てステーブルコイン、JPYC社長に聞く - 日本経済新聞,https://www.nikkei.com/article/DGXZQOCD251S00V20C25A8000000/,nikkei.com,発行・資金,0.0,JPYC、岡部典孝、金融庁,85.0,EVT-20250817-01,2025-08-17,done
63.0,2025-08-25 16:00:00,リポビタンD TREND NET -TOKYO FM 80.0MHz- - TOKYO FM,https://www.tfm.co.jp/trendnet/report/87182,tfm.co.jp,解説・論説、競合・市場環境,1.0,ダイヤモンド・ライフ、Chainalysis、シティグループ,75.0,EVT-20250817-01,2025-08-17,done
62.0,2025-08-25 16:00:00,初の円建てステーブルコイン「JPYC」 3年間で1兆円発行の勝算と危うさ - 日経ビジネス電子版,https://business.nikkei.com/atcl/gen/19/00139/082200298/,business.nikkei.com,制度・規制、取扱い・対応、解説・論説,1.0,JPYC、岡部典孝、資金移動業者、SWIFT,92.0,EVT-20250817-01,2025-08-17,done
61.0,2025-08-25 16:00:00,金融庁、初の「円建てステーブルコイン」承認で、国債市場・決済分野に大変革の可能性 - ゴールドオンライン,https://gentosha-go.com/articles/-/71303,gentosha-go.com,制度・規制、発行・資金、解説・論説,1.0,金融庁、JPYC社、岡部典孝、改正資金決済法,95.0,EVT-20250817-01,2025-08-17,done
64.0,2025-08-26 01:00:00,大阪万博ウォレット、USDC・JPYC対応で送金・決済・換金がさらに便利に＝報道 - bittimes.net,https://bittimes.net/news/209801.html,bittimes.net,活用事例、取扱い・対応、提携・連携、制度・規制、市場・統計,0.0,EXPO2025デジタルウォレット、HashPort、SBI VC、三井住友銀行,85.0,EVT-20250817-01,2025-08-17,done
65.0,2025-08-26 01:00:00,リポビタンD TREND NET -TOKYO FM 80.0MHz- - TOKYO FM,https://www.tfm.co.jp/trendnet/index.php?itemid=206897,tfm.co.jp,解説・論説,1.0,ダイヤモンド・ライフ、神庭亮介、TOKYO FM,75.0,EVT-20250817-01,2025-08-17,done
66.0,2025-08-26 16:00:00,JPYC岡部氏が日本円ステーブルコイン第1号の詳細を語る。AI経済圏での通貨主権をめぐる戦いと，新たなビジネスチャンスを解説［WebX］ - 4Gamer.net,https://www.4gamer.net/games/991/G999104/20250826031/,4gamer.net,制度・規制、解説・論説、市場・統計,1.0,岡部典孝、N.Avenue、WebX 2025,85.0,EVT-20250817-01,2025-08-17,done
67.0,2025-08-27 01:00:00,三井住友銀行、ステーブルコインのコンビニ決済目指す？ - ASCII.jp,https://ascii.jp/limit/group/ida/elem/000/004/314/4314781/,ascii.jp,制度・規制、提携・連携、解説・論説,1.0,JPYC社、金融庁、三井住友銀行、SBI VCトレード,85.0,EVT-20250817-01,2025-08-17,done
68.0,2025-08-27 01:00:00,ステーブルコインで拡大するビジネスチャンスとは。HashPort，SBI，KONAMI，メルコイン，JPYCのキーパーソンが議論［WebX］ - 4Gamer.net,https://www.4gamer.net/games/991/G999104/20250815040/,4gamer.net,解説・論説、提携・連携,1.0,SBI VCトレード、HashPort、メルコイン,65.0,EVT-20250817-01,2025-08-17,done
70.0,2025-08-27 01:00:00,EXPOウォレット、「HashPort Wallet」へ刷新── JPYC・マルチチェーン対応やガスレス機能を発表 - NADA NEWS,https://www.nadanews.com/309670/,nadanews.com,取扱い・対応,0.0,HashPort、HashPort Wallet、EXPO2025デジタルウォレット,45.0,,,done
69.0,2025-08-27 01:00:00,画像ギャラリー No.001 | JPYC岡部氏が日本円ステーブルコイン第1号の詳細を語る。AI経済圏での通貨主権をめぐる戦いと，新たなビジネスチャンスを解説［WebX］ - 4Gamer.net,https://www.4gamer.net/games/991/G999104/20250826031/screenshot.html?num=001,4gamer.net,解説・論説,1.0,岡部氏、WebX、4Gamer.net,65.0,EVT-20250817-01,2025-08-17,done
71.0,2025-08-28 01:00:00,注目のステーブルコイン､たけぞうさんが気になる関連銘柄 - 四季報オンライン,https://shikiho.toyokeizai.net/news/0/900783,shikiho.toyokeizai.net,,0.0,,0.0,,,done
72.0,2025-08-28 11:57:17,万博のウォレットアプリ、終了後はステーブルコイン対応の新アプリに刷新 - Impress Watch,https://www.watch.impress.co.jp/docs/news/2042506.html,watch.impress.co.jp,取扱い・対応、提携・連携、活用事例,0.0,HashPort、EXPO2025デジタルウォレット、HashPort Wallet、EXPOトークン,65.0,EVT-20250828-01,2025-08-28,done
